{"schema_version":1,"task_id":"H-11-semantic-codec-20260923","generated_at":"2026-09-23T08:56:43.4787295Z","artifact_root":"memo/H-11-semantic-codec-20260923","artifacts":{"knowledge":{"path":"memo/H-11-semantic-codec-20260923/knowledge.md","sha256":"cb5427ddc1b6282cd3f98b8f2053b56b8dc1aa57f22a62e40e339e2b11178570","bytes":951},"diary":{"path":"memo/H-11-semantic-codec-20260923/diary.md","sha256":"7ad75addbbe54bfb48957984d19ca35c0ea56bcbdf0f00950a29eb7651551db5","bytes":878},"walkthrough":{"path":"memo/H-11-semantic-codec-20260923/walkthrough.md","sha256":"8b84667f2172bb4566cd85734635d608df9aff138d2e464d51171de4d5b0a4da","bytes":1138},"evaluation":{"path":"memo/H-11-semantic-codec-20260923/evaluation.json","sha256":"4aa61a8ceeff56e543d790194f65d28218c38b70fad3e54465339cb425e56333","bytes":718}},"llm_memory_ingest":{"status":"SUCCESS","reason_code":"completed","receipt_id":"H-11-semantic-codec-20260923-ingest"},"llm_memory_eval":{"status":"SUCCESS","reason_code":"completed","receipt_id":"d28da05f-3472-4bea-9b48-a12368d02a8d"},"external_diary_mirror":{"status":"N_A","reason_code":"not_requested"},"memory_report_complete":true}