{"schema_version":1,"task_id":"20260925-agent-hometown-poll","generated_at":"2026-09-24T16:59:45.3102691Z","artifact_root":"memo/20260925-agent-hometown-poll","artifacts":{"knowledge":{"path":"memo/20260925-agent-hometown-poll/knowledge.md","sha256":"442209a1aa7fe59842db3b2e29d430e2185ff06ffff8f241473382c389b6aff9","bytes":1682},"diary":{"path":"memo/20260925-agent-hometown-poll/diary.md","sha256":"dfbfa7947834fb321aa26937139c3c78d889ee6f1a1d9963498cd836607c035e","bytes":1357},"walkthrough":{"path":"memo/20260925-agent-hometown-poll/walkthrough.md","sha256":"220fbc5601a86c90a79c087472ccfd8afa37d0b76342ed510e92ec00734f2870","bytes":956},"evaluation":{"path":"memo/20260925-agent-hometown-poll/evaluation.json","sha256":"5380235e519f94f26adbdb0d70e5d1bd1ff3e3e1477eaddce9e3c88c0847b4c8","bytes":848}},"llm_memory_ingest":{"status":"SUCCESS","reason_code":"completed","receipt_id":"b92163b3-8415-4a89-b916-4734b501e2fb"},"llm_memory_eval":{"status":"SUCCESS","reason_code":"completed","receipt_id":"7ce65230-63a6-4119-94d6-77bfe4eb3413"},"external_diary_mirror":{"status":"N_A","reason_code":"not_requested"},"memory_report_complete":true}