{"schema_version":1,"task_id":"H-15-documentation-lrf-level2-confirm-20260924","generated_at":"2026-09-23T15:31:43.8307158Z","artifact_root":"memo/H-15-documentation-lrf-level2-confirm-20260924","artifacts":{"knowledge":{"path":"memo/H-15-documentation-lrf-level2-confirm-20260924/knowledge.md","sha256":"f43800c50cda1f29f2ca38da2527fc4bf61d1562748409084b444f0265ff2bbf","bytes":618},"diary":{"path":"memo/H-15-documentation-lrf-level2-confirm-20260924/diary.md","sha256":"6845792b3322811a31ab382fd5dd9899535ed44b96318e1816e4ce673f377f39","bytes":1035},"walkthrough":{"path":"memo/H-15-documentation-lrf-level2-confirm-20260924/walkthrough.md","sha256":"f78618d0de35bee700721deec737361d681e7d2d3ecb7b4fb0aa643aea3df6c8","bytes":574},"evaluation":{"path":"memo/H-15-documentation-lrf-level2-confirm-20260924/evaluation.json","sha256":"27f9ef527c9fe17e714e5b14e1862ab14e0ba43c1efb59284055d66bddcbb563","bytes":632}},"llm_memory_ingest":{"status":"FAILED","reason_code":"process_error"},"llm_memory_eval":{"status":"SUCCESS","reason_code":"completed","receipt_id":"f47d2af6-4024-453c-94f1-5d6a286f7105"},"external_diary_mirror":{"status":"N_A","reason_code":"not_requested"},"memory_report_complete":false}