{"schema_version":1,"task_id":"hseq-linter-20260925","generated_at":"2026-09-24T15:53:48.6133076Z","artifact_root":"memo/hseq-linter-20260925","artifacts":{"knowledge":{"path":"memo/hseq-linter-20260925/knowledge.md","sha256":"83104b243c946cb8b0633fe5e8d4583a037c9172325976445575dcab139e2942","bytes":748},"diary":{"path":"memo/hseq-linter-20260925/diary.md","sha256":"2c23e6c6161fa8a79bbc8dc05ef4b4ab056316fbc751f6519e0c7105f44b2d27","bytes":1668},"walkthrough":{"path":"memo/hseq-linter-20260925/walkthrough.md","sha256":"dacb87069939d9ddaa4f8ca495b161cba5779f6270c9f2db183d4df75a6fff2f","bytes":1469},"evaluation":{"path":"memo/hseq-linter-20260925/evaluation.json","sha256":"010c7672a3723ac13baf7441f35be0ee719b48c18c87a12230807db09d622473","bytes":761}},"llm_memory_ingest":{"status":"SUCCESS","reason_code":"completed","receipt_id":"0617290e-7691-4eaf-b424-50060baf5049"},"llm_memory_eval":{"status":"SUCCESS","reason_code":"completed","receipt_id":"eff87495-df26-469e-a5b2-908029f93560"},"external_diary_mirror":{"status":"N_A","reason_code":"not_requested"},"memory_report_complete":true}