{"schema_version":1,"task_id":"20261018-rts-parallel-capacity-20","generated_at":"2026-10-18T10:46:08.975735351Z","artifact_root":"memo/20261018-rts-parallel-capacity-20","artifacts":{"knowledge":{"path":"memo/20261018-rts-parallel-capacity-20/knowledge.md","sha256":"e53a3bc9b5b18d2064b55a48a2b513b1588ee3b6880191502a4adea34b64fe5d","bytes":1547},"diary":{"path":"memo/20261018-rts-parallel-capacity-20/diary.md","sha256":"ce50c6bf470bfe858937a67ecf879f72b9c6f4c4169d0d4d2891a44589fed1a8","bytes":3034},"walkthrough":{"path":"memo/20261018-rts-parallel-capacity-20/walkthrough.md","sha256":"9ea4e963cdb0a58375849c6576306334a140ee46d0cbcaf66785f66dc48f6fdd","bytes":2642},"evaluation":{"path":"memo/20261018-rts-parallel-capacity-20/evaluation.json","sha256":"1963ecb161e5a46917170b0899781ca0e6d3e8fe0f491a653617e4bcfb122273","bytes":968}},"llm_memory_ingest":{"status":"FAILED","reason_code":"process_error"},"llm_memory_eval":{"status":"SUCCESS","reason_code":"completed","receipt_id":"fbbb465b-63d2-4576-b6a5-ccf73469d2ea"},"external_diary_mirror":{"status":"N_A","reason_code":"not_requested"},"memory_report_complete":false}
