{"schema_version":1,"task_id":"20260926-filereader-subagent","generated_at":"2026-09-26T08:18:29.6757083Z","artifact_root":"memo/20260926-filereader-subagent","artifacts":{"knowledge":{"path":"memo/20260926-filereader-subagent/knowledge.md","sha256":"7405800fe352d68b25d3fd43d8e027544870a0d869480ffd6281197a8c8d82d0","bytes":992},"diary":{"path":"memo/20260926-filereader-subagent/diary.md","sha256":"8823606e226c49678b048fa5f8eec8dbf3c13db4ef28b62491c6c9a03af52f8a","bytes":796},"walkthrough":{"path":"memo/20260926-filereader-subagent/walkthrough.md","sha256":"ccbc8379ee14019d1014cc11291f0f7f1f73778d89811570d76cde651e328cf9","bytes":1206},"evaluation":{"path":"memo/20260926-filereader-subagent/evaluation.json","sha256":"a88678c85647319efc0fb74414fab80c228278b0a578927dc03688eac7a377aa","bytes":327}},"llm_memory_ingest":{"status":"SUCCESS","reason_code":"completed","receipt_id":"3fb1cb06-23e9-4de9-ae7a-16863ad8adb5"},"llm_memory_eval":{"status":"SUCCESS","reason_code":"completed","receipt_id":"e0ef1ce6-fd94-4873-8c35-46a16eb37001"},"external_diary_mirror":{"status":"N_A","reason_code":"not_requested"},"memory_report_complete":true}