{"schema_version":1,"task_id":"20261018-harness-commit-push","generated_at":"2026-10-18T12:32:46.105864889Z","artifact_root":"memo/20261018-harness-commit-push","artifacts":{"knowledge":{"path":"memo/20261018-harness-commit-push/knowledge.md","sha256":"39dac02f6f1b45272f9579213aaac5608d963a89cf96b78d5954a915f3141b51","bytes":1159},"diary":{"path":"memo/20261018-harness-commit-push/diary.md","sha256":"122be90a96db3b530f0308ddeb48c43208a9b26670253f1e4596d30a9fd470f8","bytes":1732},"walkthrough":{"path":"memo/20261018-harness-commit-push/walkthrough.md","sha256":"47b6ec2d1a4b34c1a581cae0a880fff2affcc4f3b6600c958acabeea7aa50c29","bytes":971},"evaluation":{"path":"memo/20261018-harness-commit-push/evaluation.json","sha256":"971b8edb247d3bb860a1820f8bd9b8dc68d45908fda00cbf72c5d9b583d3e141","bytes":760}},"llm_memory_ingest":{"status":"SUCCESS","reason_code":"completed","receipt_id":"mem-b41ef18a22c4aa9ed2a75607"},"llm_memory_eval":{"status":"SUCCESS","reason_code":"completed","receipt_id":"955e79f6-7a4c-4a1a-9df9-7c30584d5c8e"},"external_diary_mirror":{"status":"N_A","reason_code":"not_requested"},"memory_report_complete":true}
