{"schema_version":1,"task_id":"20261018-polygllyph-format-lint","generated_at":"2026-10-18T10:29:12.168411259Z","artifact_root":"memo/20261018-polygllyph-format-lint","artifacts":{"knowledge":{"path":"memo/20261018-polygllyph-format-lint/knowledge.md","sha256":"95bfe3024235f377e22bd9c6f9d803d546f39f9e9d18a8ccfd146284a8a6d0f2","bytes":1526},"diary":{"path":"memo/20261018-polygllyph-format-lint/diary.md","sha256":"ffb0fdebcf03c8ce1ed70664864237c9e1729ae6886c2327a06433728d139d9a","bytes":2741},"walkthrough":{"path":"memo/20261018-polygllyph-format-lint/walkthrough.md","sha256":"043890f091fb8dbec4a56a1feb17167e37c9c333bf6fabaf19c766f94ce499fc","bytes":2033},"evaluation":{"path":"memo/20261018-polygllyph-format-lint/evaluation.json","sha256":"9d6651438206fbeee732ef388f3b39fbd41fe370b17860f9bfdd5d1988ee4b6b","bytes":954}},"llm_memory_ingest":{"status":"SUCCESS","reason_code":"completed","receipt_id":"mem-198daa1011244e4b71742346"},"llm_memory_eval":{"status":"SUCCESS","reason_code":"completed","receipt_id":"f0a53314-5aac-40c8-a558-15809aec8388"},"external_diary_mirror":{"status":"N_A","reason_code":"not_requested"},"memory_report_complete":true}
