{"schema_version":1,"task_id":"20261018-polygllyph-application-resume","generated_at":"2026-10-18T12:26:12.043097540Z","artifact_root":"memo/20261018-polygllyph-application-resume","artifacts":{"knowledge":{"path":"memo/20261018-polygllyph-application-resume/knowledge.md","sha256":"b9bb599449a47b6193bf355b70506ca922d9eb59df1ef14e066152478e90f225","bytes":1695},"diary":{"path":"memo/20261018-polygllyph-application-resume/diary.md","sha256":"d661b401c4768da165730e9aedd313d61ccda579ff84682477821477e742a851","bytes":2920},"walkthrough":{"path":"memo/20261018-polygllyph-application-resume/walkthrough.md","sha256":"d28e26e02bfac0aac5138b484848d478c5dcecc4f159b8ebb70e71f14b253992","bytes":2617},"evaluation":{"path":"memo/20261018-polygllyph-application-resume/evaluation.json","sha256":"e9b78d6dd25229fb6c0115a6f5b8648e08a5653f38dd22b0654c9f468a3ca2ce","bytes":1092}},"llm_memory_ingest":{"status":"SUCCESS","reason_code":"completed","receipt_id":"mem-130f1e58c6febd3813833503"},"llm_memory_eval":{"status":"SUCCESS","reason_code":"completed","receipt_id":"494743ed-1a3a-4751-82e8-b6d89c0dc5f1"},"external_diary_mirror":{"status":"N_A","reason_code":"not_requested"},"memory_report_complete":true}
