{"schema_version":1,"task_id":"20260925-persona-css","generated_at":"2026-09-24T16:48:55.3631786Z","artifact_root":"memo/20260925-persona-css","artifacts":{"knowledge":{"path":"memo/20260925-persona-css/knowledge.md","sha256":"ec83d0474433242376a63c182602bcc88a6efd67ccbdb7f53d9403e4c128e407","bytes":1253},"diary":{"path":"memo/20260925-persona-css/diary.md","sha256":"a637493a634f8a72270a51e55ceb713517b2fdc946fd7a39f1abc504a356071a","bytes":1204},"walkthrough":{"path":"memo/20260925-persona-css/walkthrough.md","sha256":"fd1910e01c113ec5c6028f0589999cf428c2e96e638a7c389e4a77bc4ade2d9d","bytes":1248},"evaluation":{"path":"memo/20260925-persona-css/evaluation.json","sha256":"d9fe7531d30a92b6b0e18deccc2abe23261c99ec259224c08330194d96084e09","bytes":906}},"llm_memory_ingest":{"status":"SUCCESS","reason_code":"completed","receipt_id":"e0c104ab-82ee-4098-b574-ebc93697b4a2"},"llm_memory_eval":{"status":"SUCCESS","reason_code":"completed","receipt_id":"0158e049-bc72-43ba-9e31-719b9d8d9de5"},"external_diary_mirror":{"status":"N_A","reason_code":"not_requested"},"memory_report_complete":true}