{"schema_version":1,"task_id":"20260925-runtime-agent-registry-final","generated_at":"2026-09-25T12:30:21.9744979Z","artifact_root":"memo/20260925-runtime-agent-registry-final","artifacts":{"knowledge":{"path":"memo/20260925-runtime-agent-registry-final/knowledge.md","sha256":"d1494b3a704d8c61a3ef737e0b7c335c149082c2f078543040f8effea1bb3ccb","bytes":1619},"diary":{"path":"memo/20260925-runtime-agent-registry-final/diary.md","sha256":"aa13a77d486d09e26b90a1b2ee2a0f16e1a5a8ffb83fbc554d7419a645693a59","bytes":1557},"walkthrough":{"path":"memo/20260925-runtime-agent-registry-final/walkthrough.md","sha256":"f2d94e82f3a6666f5f0c4c5f73dac843d10a979a5b9dd06f893fc0acfd73b479","bytes":1654},"evaluation":{"path":"memo/20260925-runtime-agent-registry-final/evaluation.json","sha256":"24422f0d61c123fb8a228feb3677724c4e44f01b1430b785e6ba0a9f88d72b97","bytes":1128}},"llm_memory_ingest":{"status":"SUCCESS","reason_code":"completed","receipt_id":"c8119c88-c1bc-4c32-ad04-ff319798c0f9"},"llm_memory_eval":{"status":"SUCCESS","reason_code":"completed","receipt_id":"d3897068-b13f-4d4c-beff-88983902dca7"},"external_diary_mirror":{"status":"N_A","reason_code":"not_requested"},"memory_report_complete":true}