{"schema_version":1,"task_id":"llm-mem-repair-20261025","generated_at":"2026-10-25T10:29:06.6028489Z","artifact_root":"memo/llm-mem-repair-20261025","artifacts":{"knowledge":{"path":"memo/llm-mem-repair-20261025/knowledge.md","sha256":"24ea196d385f2853dd3b1ce395807d8079ded4637bc96da9d4113c9693782ea6","bytes":467},"diary":{"path":"memo/llm-mem-repair-20261025/diary.md","sha256":"f68527d7b8c74e140d1754bdfaeb6445e723c77b836433a796e47d14399194dc","bytes":350},"walkthrough":{"path":"memo/llm-mem-repair-20261025/walkthrough.md","sha256":"badbc89b361a7e9b90ca90d56c7dbeb81c1bca42509a3985e77ceaf80a70530e","bytes":370},"evaluation":{"path":"memo/llm-mem-repair-20261025/evaluation.json","sha256":"b6723807733d750de9378a818069750a83f73c1ef254cec0082638452d671130","bytes":506}},"llm_memory_ingest":{"status":"FAILED","reason_code":"process_error"},"llm_memory_eval":{"status":"FAILED","reason_code":"process_error"},"external_diary_mirror":{"status":"N_A","reason_code":"not_requested"},"memory_report_complete":false}