{"schema_version":1,"task_id":"20261025-powershell-settings-secret-stop","generated_at":"2026-10-25T03:56:00.1782330Z","artifact_root":"memo/20261025-powershell-settings-secret-stop","artifacts":{"knowledge":{"path":"memo/20261025-powershell-settings-secret-stop/knowledge.md","sha256":"74199f84f2dd1656ec0e4c2c9602e7eb852ec431400f908fd377891af98d10ba","bytes":1668},"diary":{"path":"memo/20261025-powershell-settings-secret-stop/diary.md","sha256":"660ea5910b11f622e0622fcd7a7aa24f5fa605a5d80c655657b89bfacddee516","bytes":2333},"walkthrough":{"path":"memo/20261025-powershell-settings-secret-stop/walkthrough.md","sha256":"0680cfa269c05bff5699dbc8b646983ab8e02a09c2313a8c7fd11a5b3ff44c49","bytes":2269},"evaluation":{"path":"memo/20261025-powershell-settings-secret-stop/evaluation.json","sha256":"8255fd42d3649298d8fb5a75e20bd523a920dc16b378331c35d87d233c341d63","bytes":831}},"llm_memory_ingest":{"status":"FAILED","reason_code":"process_error"},"llm_memory_eval":{"status":"FAILED","reason_code":"process_error"},"external_diary_mirror":{"status":"N_A","reason_code":"not_requested"},"memory_report_complete":false}