{"schema_version":1,"task_id":"20261025-powershell-config-sanitization","generated_at":"2026-10-25T04:22:52.6971795Z","artifact_root":"memo/20261025-powershell-config-sanitization","artifacts":{"knowledge":{"path":"memo/20261025-powershell-config-sanitization/knowledge.md","sha256":"e37f3385b1b71a45651177124175a0457451e54ffab9fd42b9d4c045f4859154","bytes":2901},"diary":{"path":"memo/20261025-powershell-config-sanitization/diary.md","sha256":"2bc06d79c3c3e2bb09d6f1455ed7d9c84affce868e9aec284e7ed32c0da357fd","bytes":2583},"walkthrough":{"path":"memo/20261025-powershell-config-sanitization/walkthrough.md","sha256":"84b9c9ed3a2a2cd6f6e3862f43ac507509b1823c8f6f90921a48eda272cd1126","bytes":2639},"evaluation":{"path":"memo/20261025-powershell-config-sanitization/evaluation.json","sha256":"4087269d1808fb4e7c6a7063e630913d4df2926ae572826e12c54199335648ef","bytes":1251}},"llm_memory_ingest":{"status":"FAILED","reason_code":"process_error"},"llm_memory_eval":{"status":"FAILED","reason_code":"process_error"},"external_diary_mirror":{"status":"N_A","reason_code":"not_requested"},"memory_report_complete":false}