{"schema_version":1,"task_id":"H-13-llm-only-doc-codec-20260923","generated_at":"2026-09-23T14:27:18.1212172Z","artifact_root":"memo/H-13-llm-only-doc-codec-20260923","artifacts":{"knowledge":{"path":"memo/H-13-llm-only-doc-codec-20260923/knowledge.md","sha256":"20b3c3bd57ee9e706159277f7f9d923a582280f1caaf6cd947a5158a763621bf","bytes":1633},"diary":{"path":"memo/H-13-llm-only-doc-codec-20260923/diary.md","sha256":"c8901bb6f7078042969be7e0aef1dbb9832eec55f63e4c7372c7c88d46267ab1","bytes":874},"walkthrough":{"path":"memo/H-13-llm-only-doc-codec-20260923/walkthrough.md","sha256":"37e76adbb3b663f13339e4227a3526f12b323bba2762a0d408e1057ff03f8568","bytes":629},"evaluation":{"path":"memo/H-13-llm-only-doc-codec-20260923/evaluation.json","sha256":"d096599b93e95842d815804977b75e42e575c9cd40f21b09daa03606fa6759ec","bytes":579}},"llm_memory_ingest":{"status":"SUCCESS","reason_code":"completed","receipt_id":"H-13-llm-only-doc-codec-20260923-ingest"},"llm_memory_eval":{"status":"SUCCESS","reason_code":"completed","receipt_id":"8e61b2f8-ac2c-4a1c-940a-914d71bbf0e3"},"external_diary_mirror":{"status":"N_A","reason_code":"not_requested"},"memory_report_complete":true}