{"schema_version":1,"task_id":"H-08","generated_at":"2026-09-09T21:28:41.4753427Z","artifact_root":"memo/H-08","artifacts":{"knowledge":{"path":"memo/H-08/knowledge.md","sha256":"5a870702cf87e328f79dfd0bb4f52a8b6660b5a0141d36c32adffaba73266c70","bytes":1286},"diary":{"path":"memo/H-08/diary.md","sha256":"cb3ed2f21f817582e1dc46efaa2b340bd900cbf7f05fca5b3c0b9efa5fb5abf7","bytes":1343},"walkthrough":{"path":"memo/H-08/walkthrough.md","sha256":"cdcbd8a3cd1e6f57990b0ae5b336b984248b8345c8a227322b4f56542947b6db","bytes":1190},"evaluation":{"path":"memo/H-08/evaluation.json","sha256":"25489ff3c6f56e112d67c7b0625ebfd43b147445ea242a375f622cf7015bc387","bytes":836}},"llm_memory_ingest":{"status":"SUCCESS","reason_code":"completed","receipt_id":"5e669d9e-27d0-419a-9f79-4239c43e406e"},"llm_memory_eval":{"status":"SUCCESS","reason_code":"completed","receipt_id":"b0fccd89-75ac-40cc-a37a-163781e21ee9"},"external_diary_mirror":{"status":"N_A","reason_code":"not_requested"},"memory_report_complete":true}