{"schema_version":1,"task_id":"20261027-pi-attacker-profiles","generated_at":"2026-10-26T21:21:11.4880529Z","artifact_root":"memo/20261027-pi-attacker-profiles","artifacts":{"knowledge":{"path":"memo/20261027-pi-attacker-profiles/knowledge.md","sha256":"e7571fe92868dd53fcb6e32cfb506048feded66ea696fe0ec2b4bba5ece54aaf","bytes":1821},"diary":{"path":"memo/20261027-pi-attacker-profiles/diary.md","sha256":"e59bed28e033b76b268f79d0c9c02b743a02c751c7cf2976a200cc4a1038c533","bytes":2104},"walkthrough":{"path":"memo/20261027-pi-attacker-profiles/walkthrough.md","sha256":"030f95bbf1fd3f53e18f70a6b9fc8b3960cf200709455499365bfb46ce014f62","bytes":2680},"evaluation":{"path":"memo/20261027-pi-attacker-profiles/evaluation.json","sha256":"57eae2ade31be5c3782413e040ba819ed56815a3e7f044457626621845a93a84","bytes":514}},"llm_memory_ingest":{"status":"SUCCESS","reason_code":"completed","receipt_id":"b3695473-2f32-40db-b5a1-9bd53355da84"},"llm_memory_eval":{"status":"SUCCESS","reason_code":"completed","receipt_id":"cf7e3d26-56c4-4b78-b978-49550d5dd8ae"},"external_diary_mirror":{"status":"N_A","reason_code":"not_requested"},"memory_report_complete":true}