{"schema_version":1,"task_id":"20260925-compressor-orchestrator-implementation","generated_at":"2026-09-24T16:33:09.1851860Z","artifact_root":"memo/20260925-compressor-orchestrator-implementation","artifacts":{"knowledge":{"path":"memo/20260925-compressor-orchestrator-implementation/knowledge.md","sha256":"733ceb6fa3c192b4f1bc1bcff2dbfb8d9ed06517f9e4b6d357990138fd727799","bytes":1468},"diary":{"path":"memo/20260925-compressor-orchestrator-implementation/diary.md","sha256":"aa12336d1f0726d3c372e22d578973c8246b33efb5b5c917454e0648f66e08ac","bytes":1665},"walkthrough":{"path":"memo/20260925-compressor-orchestrator-implementation/walkthrough.md","sha256":"6592a0d635e3b86baac1e3b09a9234e58e511b58f90dcc2ddad92b28cbca1c3a","bytes":2183},"evaluation":{"path":"memo/20260925-compressor-orchestrator-implementation/evaluation.json","sha256":"598497451c9fe028f7a9680b2f4ffd6a6ef98018bcbdf9678e53232c378e758e","bytes":1165}},"llm_memory_ingest":{"status":"SUCCESS","reason_code":"completed","receipt_id":"85553e0d-3c09-45d4-9646-6f987d8a4762"},"llm_memory_eval":{"status":"SUCCESS","reason_code":"completed","receipt_id":"2ac22a11-1db5-4240-8c8e-9ad947878162"},"external_diary_mirror":{"status":"N_A","reason_code":"not_requested"},"memory_report_complete":true}