{"schema_version":1,"task_id":"hseq-skill-pidgin-20260925","generated_at":"2026-09-24T16:03:32.5548035Z","artifact_root":"memo/hseq-skill-pidgin-20260925","artifacts":{"knowledge":{"path":"memo/hseq-skill-pidgin-20260925/knowledge.md","sha256":"b41e6f16f226bec3910853a93712da4bd0d91b15e1cb23ede354cd6f6c2b3e94","bytes":373},"diary":{"path":"memo/hseq-skill-pidgin-20260925/diary.md","sha256":"67fa144c6123cac09abdcf3763aedf8e69c4f09a1f1baa2bc41aa4d1af8b6fd7","bytes":1003},"walkthrough":{"path":"memo/hseq-skill-pidgin-20260925/walkthrough.md","sha256":"d0011e4f4bde5476905c5f7ccf139c1e775b4dd74890f0c410c92028553aa564","bytes":539},"evaluation":{"path":"memo/hseq-skill-pidgin-20260925/evaluation.json","sha256":"cd3003a9cc57f3587ca8d883177117efa7c882374a0b6aecb03887e3d751c90d","bytes":746}},"llm_memory_ingest":{"status":"SUCCESS","reason_code":"completed","receipt_id":"aa4b079e-8485-4207-a52e-14b2842aca54"},"llm_memory_eval":{"status":"SUCCESS","reason_code":"completed","receipt_id":"aef42302-2dd6-40a4-90c4-d4854290fb58"},"external_diary_mirror":{"status":"N_A","reason_code":"not_requested"},"memory_report_complete":true}