{"schema_version":1,"task_id":"H-09-contradictions-20260914","generated_at":"2026-09-15T11:53:49.6923235Z","artifact_root":"memo/H-09-contradictions-20260914","artifacts":{"knowledge":{"path":"memo/H-09-contradictions-20260914/knowledge.md","sha256":"0517e8dba033a9776d56151cf55feea5ce85e28fa6221a7605b5b7c10ebd5f8e","bytes":1650},"diary":{"path":"memo/H-09-contradictions-20260914/diary.md","sha256":"c57a4f6172ae5868901e29c01e5b6597c3808bb2ea88ede6dd67736fa1ddf72d","bytes":2844},"walkthrough":{"path":"memo/H-09-contradictions-20260914/walkthrough.md","sha256":"4e7fef0ea6c4f683c08d664bf9a9628222cb73d4c23db614d93792007c148e17","bytes":3525},"evaluation":{"path":"memo/H-09-contradictions-20260914/evaluation.json","sha256":"93cbd6b709f2eecac381c9aea348c85ffd94943d6aee4447ea69270e7c856370","bytes":1079}},"llm_memory_ingest":{"status":"SUCCESS","reason_code":"completed","receipt_id":"140ec968-231b-4e3a-93e2-864b47ac505a"},"llm_memory_eval":{"status":"SUCCESS","reason_code":"completed","receipt_id":"153b6470-2fbe-4a29-8505-3688823e09c3"},"external_diary_mirror":{"status":"N_A","reason_code":"not_requested"},"memory_report_complete":true}