{"schema_version":1,"task_id":"codex-agents-symlink-20260925","generated_at":"2026-09-24T15:43:08.9472048Z","artifact_root":"memo/codex-agents-symlink-20260925","artifacts":{"knowledge":{"path":"memo/codex-agents-symlink-20260925/knowledge.md","sha256":"293859ee4d09455bd4791b0d16f61196bc0f39eda65589b05a2d1174cc9f7e43","bytes":624},"diary":{"path":"memo/codex-agents-symlink-20260925/diary.md","sha256":"4cf326bcb5708310d7dcade84a8a6e6b4d455e4ff0e32dd8afc463e9321fdda5","bytes":960},"walkthrough":{"path":"memo/codex-agents-symlink-20260925/walkthrough.md","sha256":"f179087737fe7a5ab667e8565e8c88ba02fecc7f978f54f459ff2de4240a39d4","bytes":706},"evaluation":{"path":"memo/codex-agents-symlink-20260925/evaluation.json","sha256":"3a3ae2b8e60515e95f2d179c7f3e0ffef1e630fa72209dbaf11d85f2b7bae8a4","bytes":761}},"llm_memory_ingest":{"status":"FAILED","reason_code":"process_error"},"llm_memory_eval":{"status":"SUCCESS","reason_code":"completed","receipt_id":"1bb64aef-9359-48f9-ae18-6c035c94311c"},"external_diary_mirror":{"status":"N_A","reason_code":"not_requested"},"memory_report_complete":false}