{"schema_version":1,"task_id":"20260925-runtime-agent-registration","generated_at":"2026-09-24T17:18:00.8870702Z","artifact_root":"memo/20260925-runtime-agent-registration","artifacts":{"knowledge":{"path":"memo/20260925-runtime-agent-registration/knowledge.md","sha256":"aef2b80d27097c40c58fbda34448cee0bfdd187d9b256c634106e089e6b95677","bytes":1612},"diary":{"path":"memo/20260925-runtime-agent-registration/diary.md","sha256":"01f9c89ab396a511cf9578e7972c2e763c1f1f1e2fd54e68516ef232d8958d7e","bytes":1500},"walkthrough":{"path":"memo/20260925-runtime-agent-registration/walkthrough.md","sha256":"3619bf6afb6acac6ca90f054fb060e7181c5fee59b3cdb38307595fe35948e43","bytes":1753},"evaluation":{"path":"memo/20260925-runtime-agent-registration/evaluation.json","sha256":"a2c964c5f41fc2d341a37b910e0cd2e46cbfe879920c7bcc7b7b354f6521151d","bytes":1100}},"llm_memory_ingest":{"status":"SUCCESS","reason_code":"completed","receipt_id":"bb97376b-9ad6-4863-b007-08bad3ba9edf"},"llm_memory_eval":{"status":"SUCCESS","reason_code":"completed","receipt_id":"efb49002-423c-42b5-93e5-085127ddbccd"},"external_diary_mirror":{"status":"N_A","reason_code":"not_requested"},"memory_report_complete":true}