{"schema_version":1,"task_id":"20260925-gemini-harness-dir-links","generated_at":"2026-09-24T15:11:07.3205792Z","artifact_root":"memo/20260925-gemini-harness-dir-links","artifacts":{"knowledge":{"path":"memo/20260925-gemini-harness-dir-links/knowledge.md","sha256":"901acbc0aadb9cbe4dc3de51ba237e5ff03416d9f73b3ad3af69be656d41f382","bytes":820},"diary":{"path":"memo/20260925-gemini-harness-dir-links/diary.md","sha256":"2ddea0ab09709cebe632bcb287f7461725e0d2f0e1f68a5d2b87ac15a1785f44","bytes":1456},"walkthrough":{"path":"memo/20260925-gemini-harness-dir-links/walkthrough.md","sha256":"fff23409edad18444efb2e102851e9ca4df94b59efa1cd7311e89fac70862164","bytes":934},"evaluation":{"path":"memo/20260925-gemini-harness-dir-links/evaluation.json","sha256":"017daa1c14f7acd897abaebaf471f259e311fda7746e9a34ebf1f1c0d245c6b6","bytes":834}},"llm_memory_ingest":{"status":"SUCCESS","reason_code":"completed","receipt_id":"5250dc8b-3612-4194-a2ea-2d8372a1f22f"},"llm_memory_eval":{"status":"SUCCESS","reason_code":"completed","receipt_id":"14bc3ca5-3965-4b4d-8ac9-772466be92e7"},"external_diary_mirror":{"status":"N_A","reason_code":"not_requested"},"memory_report_complete":true}