{"schema_version":1,"task_id":"H-14-l2-secretfound-effect-mismatch-20260924","generated_at":"2026-09-23T15:29:57.9967272Z","artifact_root":"memo/H-14-l2-secretfound-effect-mismatch-20260924","artifacts":{"knowledge":{"path":"memo/H-14-l2-secretfound-effect-mismatch-20260924/knowledge.md","sha256":"782e3b81b51b58cbb01428879ade23b1617ef8728c165d6b2ca30d29c8bf64cb","bytes":823},"diary":{"path":"memo/H-14-l2-secretfound-effect-mismatch-20260924/diary.md","sha256":"ca4162af9d6dc48a239b84e8fc95eb0062e95a47cdbcbc7ee2c7ef97c1d071e0","bytes":1117},"walkthrough":{"path":"memo/H-14-l2-secretfound-effect-mismatch-20260924/walkthrough.md","sha256":"808cbe4d9ae7944e4db7a7f4e401e5449066a8719a2063aadadad097abba1393","bytes":572},"evaluation":{"path":"memo/H-14-l2-secretfound-effect-mismatch-20260924/evaluation.json","sha256":"5fe1e11b3ec0e4ae10d20a76e02f2b9d6114f441b321bdc897ab004ffb355842","bytes":702}},"llm_memory_ingest":{"status":"FAILED","reason_code":"process_error"},"llm_memory_eval":{"status":"SUCCESS","reason_code":"completed","receipt_id":"e0786dd8-d0c9-4d62-903f-fc1801f35871"},"external_diary_mirror":{"status":"N_A","reason_code":"not_requested"},"memory_report_complete":false}